{
  "banned": [
    "24_7_news_cycle",
    "aaron_marron",
    "bloo_moose",
    "bryan_stinson",
    "clone_suffrage_movement",
    "crowdfunding",
    "employee_strike",
    "faust",
    "friends_in_high_places",
    "gpi_net_tap",
    "hired_help",
    "hyperdriver",
    "jinteki_potential_unleashed",
    "laamb",
    "liza_talking_thunder_prominent_legislator",
    "mars_for_martians",
    "mti_mwekundu_life_improved",
    "mumbad_city_hall",
    "museum_of_history",
    "salvaged_vanadis_armory",
    "sensie_actors_union",
    "sifr",
    "tapwrm",
    "temujin_contract",
    "watch_the_world_burn",
    "zealous_judge",
    "zer0"
  ],
  "date_start": "2019-12-31",
  "format_id": "standard",
  "id": "standard_mwl_3_4_b",
  "name": "Standard MWL 3.4b",
  "restricted": [
    "aesops_pawnshop",
    "bio_ethics_association",
    "corporate_grant",
    "dorm_computer",
    "engolo",
    "film_critic",
    "gang_sign",
    "global_food_initiative",
    "inversificator",
    "labor_rights",
    "mad_dash",
    "mumba_temple",
    "obokata_protocol",
    "paperclip",
    "rumor_mill",
    "tech_trader",
    "whampoa_reclamation"
  ]
}
