{
  "id": "standard_mwl_3_0",
  "name": "Standard MWL 3.0",
  "date_start": "2018-12-21",
  "format_id": "standard",
  "restricted": [
    "aesops_pawnshop",
    "bio_ethics_association",
    "commercial_bankers_group",
    "employee_strike",
    "excalibur",
    "film_critic",
    "gang_sign",
    "global_food_initiative",
    "inversificator",
    "jinteki_potential_unleashed",
    "levy_ar_lab_access",
    "mad_dash",
    "mother_goddess",
    "mti_mwekundu_life_improved",
    "mumba_temple",
    "mumbad_city_hall",
    "obokata_protocol",
    "paperclip",
    "rumor_mill",
    "surveyor",
    "violet_level_clearance",
    "whampoa_reclamation"
  ],
  "banned": [
    "24_7_news_cycle",
    "aaron_marron",
    "bloo_moose",
    "bryan_stinson",
    "cerebral_imaging_infinite_frontiers",
    "clone_suffrage_movement",
    "faust",
    "friends_in_high_places",
    "hired_help",
    "hyperdriver",
    "mars_for_martians",
    "museum_of_history",
    "salvaged_vanadis_armory",
    "sensie_actors_union",
    "sifr",
    "tapwrm",
    "temujin_contract",
    "watch_the_world_burn",
    "zer0"
  ]
}
