{
  "banned": [
    "24_7_news_cycle",
    "aaron_marron",
    "another_day_another_paycheck",
    "azmari_edtech_shaping_the_future",
    "bloo_moose",
    "breached_dome",
    "bryan_stinson",
    "cayambe_grid",
    "cerebral_static",
    "clan_vengeance",
    "clone_suffrage_movement",
    "clones_are_not_people",
    "corporate_grant",
    "corporate_scandal",
    "crowdfunding",
    "death_and_taxes",
    "defective_brainchips",
    "door_to_door",
    "employee_strike",
    "encore",
    "enforced_curfew",
    "engram_flush",
    "enhanced_login_protocol",
    "fairchild_3_0",
    "freedom_through_equality",
    "friends_in_high_places",
    "gagarin_deep_space_expanding_the_horizon",
    "game_changer",
    "gold_farmer",
    "government_investigations",
    "government_takeover",
    "gpi_net_tap",
    "hacktivist_meeting",
    "hired_help",
    "housekeeping",
    "interdiction",
    "itinerant_protesters",
    "jinteki_potential_unleashed",
    "kakugo",
    "kill_switch",
    "laamb",
    "lag_time",
    "liza_talking_thunder_prominent_legislator",
    "mad_dash",
    "manhunt",
    "mars_for_martians",
    "mass_commercialization",
    "media_blitz",
    "mti_mwekundu_life_improved",
    "mumbad_city_hall",
    "museum_of_history",
    "net_celebrity",
    "pad_tap",
    "paywall_implementation",
    "predictive_algorithm",
    "rolling_brownout",
    "rumor_mill",
    "salvaged_vanadis_armory",
    "scarcity_of_resources",
    "scrubbed",
    "sensie_actors_union",
    "service_outage",
    "shipment_from_tennin",
    "sifr",
    "slot_machine",
    "ssl_endorsement",
    "surveillance_sweep",
    "system_outage",
    "system_seizure",
    "targeted_marketing",
    "temujin_contract",
    "titan_transnational_investing_in_your_future",
    "traffic_jam",
    "unscheduled_maintenance",
    "violet_level_clearance",
    "watch_the_world_burn",
    "whampoa_reclamation",
    "zealous_judge"
  ],
  "date_start": "2021-06-19",
  "format_id": "standard",
  "id": "standard_ban_list_21_06",
  "name": "Standard Ban List 21.06",
  "subtypes": {
    "banned": ["current"]
  }
}
